{
  "id": "topic-c3ec7d27cbd5",
  "date": "2026-07-01",
  "title": "Frontier AI platforms: best daily content opportunity",
  "theme": "Frontier AI platforms",
  "source_item_ids": [
    "src-9f85c8c0dbfb",
    "src-ab2427916a80",
    "src-1323e7e001ff",
    "src-3ac5fd25483b",
    "src-5b9ed65cb972",
    "src-3d2c7fb83203",
    "src-a47727bb3a43",
    "src-b2caaddad2a6",
    "src-535fe5e28b3b",
    "src-0a7ea7563d50",
    "src-e9b5c89a784a",
    "src-ed095fb88b51",
    "src-415327b6fcff",
    "src-efafc48d92da",
    "src-da00a5927fa6",
    "src-34f391a57b7f",
    "src-a3415cb241ba",
    "src-34b5cefd1415",
    "src-36b6ef7bb9a4",
    "src-33ddbfa7254b",
    "src-be59d1204b1d",
    "src-5af899e8b82e",
    "src-5995f156fdb6",
    "src-32c45f81ff88",
    "src-21781f268854",
    "src-f24c44f5e61f",
    "src-09d431ff1e17",
    "src-9f3aeac87b48",
    "src-eae9e0dcfcd4",
    "src-265214aaf552",
    "src-349336a4588f",
    "src-39a989d445c3",
    "src-da73692313ab",
    "src-199882dbf26e",
    "src-2096fb736bf4",
    "src-463bfa9e8969",
    "src-006d182077fa",
    "src-d8c35ab8a2a5",
    "src-e8a15f52c815",
    "src-a4f9856024db"
  ],
  "score": 84.3,
  "score_breakdown": {
    "business_relevance": 92,
    "source_authority": 95.0,
    "freshness": 80,
    "novelty": 70,
    "implementation_value": 74,
    "audience_fit": 82
  },
  "score_reasons": [
    "40 source item(s) found in the cluster",
    "Priority is high",
    "Topic fits the operator-facing AI content strategy"
  ],
  "recommended_angle": "Explain what changed in Frontier AI platforms and convert it into a practical implementation narrative for AI operators.",
  "audience_fit": "AI operators, enterprise solution architects, and founders evaluating agent workflows",
  "status": "ranked"
}
